{
  "schema": "financial.snapshot/v2",
  "sequence": 1,
  "as_of": "2026-08-19T11:00:00+00:00",
  "accounting_perimeter": "SINERGY_CONSOLIDATED",
  "reporting_currency": "USDC",
  "ledger_digest": "6393c6430b621d0418287007af3334310fa0b0dad6a68ff84e486f26712d9482",
  "ledger_last_entry_digest": "f38f6ce7c8a23bea46b95681b21aa490af7b8b1797252ec6645f76c2c3eb6086",
  "account_registry_digest": "95ecf0a570c3612899e260a2ad4207e26ccbaa178c00f7acbde5f11920e5cc56",
  "valuation_policy_id": "cycle-policy-v1",
  "valuation_policy_digest": "12357e94f201e43412b1299fc2749d84decf2abc9df892e9d28686a07f83bfcd",
  "valuation_policy_as_of": "2026-08-19T10:29:00+00:00",
  "period_start_sequence": 0,
  "previous_snapshot_digest": null,
  "hard_external_assets": "125",
  "external_liabilities": "7",
  "immediate_external_liabilities": "7",
  "hard_nav": "118",
  "liquid_nav": "118",
  "economic_nav": "118",
  "hard_coverage": "17.85714285714285714285714286",
  "net_new_capital": "0",
  "realized_external_revenue": "118",
  "realized_external_pnl": "118",
  "hard_nav_surplus_after_capital": "118",
  "required_retention": "0",
  "loss_carryforward": "0",
  "period_profit_budget": "118",
  "required_hard_nav_buffer": "0",
  "distribution_capacity": "118",
  "liquidity_horizons": [
    {"horizon_weeks":1,"liquid_resources":"125","expected_net_outflows":"0","lcr":null,"liquidity_surplus":"125"},
    {"horizon_weeks":4,"liquid_resources":"125","expected_net_outflows":"0","lcr":null,"liquidity_surplus":"125"},
    {"horizon_weeks":8,"liquid_resources":"125","expected_net_outflows":"0","lcr":null,"liquidity_surplus":"125"}
  ],
  "maturity_snapshot_refs": [],
  "policy_mode": "NORMAL",
  "invariant_failures": [],
  "digest": "cc90650d55d69b6e2066c00f2590e2faf7b991de75fb3d277a1da7b8d741ae1b"
}
